{
  "$id": "urn:world-studio:schema:world_studio.reconstruction_result.v0.1",
  "$schema": "https://json-schema.org/draft/2020-12/schema",
  "additionalProperties": false,
  "allOf": [
    {
      "if": {
        "properties": {
          "status": {
            "const": "completed"
          }
        }
      },
      "then": {
        "properties": {
          "failure": {
            "type": "null"
          },
          "outputs": {
            "minItems": 1,
            "type": "array"
          }
        }
      },
      "else": {
        "properties": {
          "failure": {
            "additionalProperties": false,
            "properties": {
              "code": {
                "$ref": "#/$defs/identifier"
              },
              "message": {
                "maxLength": 4096,
                "minLength": 1,
                "type": "string"
              },
              "retryable": {
                "type": "boolean"
              }
            },
            "required": [
              "code",
              "message",
              "retryable"
            ],
            "type": "object"
          },
          "outputs": {
            "maxItems": 0,
            "type": "array"
          }
        }
      }
    }
  ],
  "properties": {
    "attempt": {
      "maximum": 9007199254740991,
      "minimum": 1,
      "type": "integer"
    },
    "authority": {
      "const": "proposal_only"
    },
    "failure": {
      "anyOf": [
        {
          "additionalProperties": false,
          "properties": {
            "code": {
              "$ref": "#/$defs/identifier"
            },
            "message": {
              "maxLength": 4096,
              "minLength": 1,
              "type": "string"
            },
            "retryable": {
              "type": "boolean"
            }
          },
          "required": [
            "code",
            "message",
            "retryable"
          ],
          "type": "object"
        },
        {
          "type": "null"
        }
      ]
    },
    "finished_at": {
      "$ref": "#/$defs/timestamp"
    },
    "job_id": {
      "$ref": "#/$defs/identifier"
    },
    "job_sha256": {
      "$ref": "#/$defs/sha256"
    },
    "loaded_world_effect": {
      "const": "none"
    },
    "outputs": {
      "items": {
        "$ref": "#/$defs/outputArtifactReference"
      },
      "maxItems": 1024,
      "type": "array"
    },
    "schema": {
      "const": "world_studio.reconstruction_result.v0.1"
    },
    "started_at": {
      "$ref": "#/$defs/timestamp"
    },
    "status": {
      "enum": [
        "completed",
        "failed",
        "cancelled",
        "timed_out",
        "interrupted"
      ]
    },
    "usage": {
      "additionalProperties": false,
      "properties": {
        "log_bytes": {
          "$ref": "#/$defs/nonNegativeSafeInteger"
        },
        "output_artifacts": {
          "maximum": 1024,
          "minimum": 0,
          "type": "integer"
        },
        "output_bytes": {
          "$ref": "#/$defs/nonNegativeSafeInteger"
        },
        "peak_memory_bytes": {
          "$ref": "#/$defs/nonNegativeSafeInteger"
        },
        "wall_time_ms": {
          "$ref": "#/$defs/nonNegativeSafeInteger"
        }
      },
      "required": [
        "wall_time_ms",
        "peak_memory_bytes",
        "output_bytes",
        "output_artifacts",
        "log_bytes"
      ],
      "type": "object"
    },
    "worker": {
      "additionalProperties": false,
      "properties": {
        "capability_sha256": {
          "$ref": "#/$defs/sha256"
        },
        "worker_id": {
          "$ref": "#/$defs/identifier"
        }
      },
      "required": [
        "worker_id",
        "capability_sha256"
      ],
      "type": "object"
    }
  },
  "required": [
    "schema",
    "job_id",
    "attempt",
    "status",
    "started_at",
    "finished_at",
    "worker",
    "job_sha256",
    "outputs",
    "usage",
    "failure",
    "authority",
    "loaded_world_effect"
  ],
  "title": "World Studio reconstruction result v0.1",
  "type": "object",
  "$defs": {
    "identifier": {
      "maxLength": 128,
      "pattern": "^[A-Za-z0-9][A-Za-z0-9._-]{0,127}$",
      "type": "string"
    },
    "mediaType": {
      "pattern": "^[a-z0-9][a-z0-9!#$&^_.+-]*/[a-z0-9][a-z0-9!#$&^_.+-]*$",
      "type": "string"
    },
    "nonNegativeSafeInteger": {
      "maximum": 9007199254740991,
      "minimum": 0,
      "type": "integer"
    },
    "outputArtifactReference": {
      "additionalProperties": false,
      "properties": {
        "coordinate_frame": {
          "anyOf": [
            {
              "$ref": "#/$defs/identifier"
            },
            {
              "type": "null"
            }
          ]
        },
        "media_type": {
          "$ref": "#/$defs/mediaType"
        },
        "path": {
          "$ref": "#/$defs/safeRelativePath"
        },
        "role": {
          "$ref": "#/$defs/identifier"
        },
        "sha256": {
          "$ref": "#/$defs/sha256"
        },
        "size_bytes": {
          "maximum": 9007199254740991,
          "minimum": 1,
          "type": "integer"
        }
      },
      "required": [
        "role",
        "path",
        "sha256",
        "size_bytes",
        "media_type",
        "coordinate_frame"
      ],
      "type": "object"
    },
    "safeRelativePath": {
      "maxLength": 1024,
      "minLength": 1,
      "not": {
        "anyOf": [
          {
            "pattern": "^/"
          },
          {
            "pattern": "\\\\"
          },
          {
            "pattern": "//|/$"
          },
          {
            "pattern": "^[A-Za-z][A-Za-z0-9+.-]*:"
          },
          {
            "pattern": "(^|/)\\.\\.?(/|$)"
          }
        ]
      },
      "pattern": "^[^\\u0000]+$",
      "type": "string"
    },
    "sha256": {
      "pattern": "^sha256:[0-9a-f]{64}$",
      "type": "string"
    },
    "timestamp": {
      "pattern": "^[1-9][0-9]{3}-[0-9]{2}-[0-9]{2}T[0-9]{2}:[0-9]{2}:[0-9]{2}(?:\\.[0-9]{3})?Z$",
      "type": "string"
    }
  }
}
