{
  "attempt": 1,
  "authority": "proposal_only",
  "failure": null,
  "finished_at": "2026-08-09T10:01:10.000Z",
  "job_id": "worker-job-0001",
  "job_sha256": "sha256:9db89beae6573106cc8d17e20315250995c69b0fd837d7c4643573f6c8524fe8",
  "loaded_world_effect": "none",
  "outputs": [
    {
      "coordinate_frame": "arkit_world",
      "media_type": "application/json",
      "path": "attempts/0001/outputs/checkpoint-0001.json",
      "role": "preview-manifest",
      "sha256": "sha256:4444444444444444444444444444444444444444444444444444444444444444",
      "size_bytes": 1024
    }
  ],
  "schema": "world_studio.reconstruction_result.v0.1",
  "started_at": "2026-08-09T10:01:01.000Z",
  "status": "completed",
  "usage": {
    "log_bytes": 512,
    "output_artifacts": 1,
    "output_bytes": 1024,
    "peak_memory_bytes": 33554432,
    "wall_time_ms": 9000
  },
  "worker": {
    "capability_sha256": "sha256:032a657bf3d39e5194d13401f5b7f215bf1b12804bff9786a6816db6313a466b",
    "worker_id": "fixture-reconstruction-worker"
  }
}
